<?xml encoding="UTF-8"?>

<!ELEMENT ns1:TEI (ns1:teiHeader,ns1:text)>
<!ATTLIST ns1:TEI
  xmlns:ns1 CDATA #FIXED 'http://www.tei-c.org/ns/1.0'>

<!ELEMENT ns1:teiHeader (ns1:fileDesc,ns1:encodingDesc,ns1:profileDesc)>
<!ATTLIST ns1:teiHeader
  xmlns:ns1 CDATA #FIXED 'http://www.tei-c.org/ns/1.0'>

<!ELEMENT ns1:text (ns1:body)>
<!ATTLIST ns1:text
  xmlns:ns1 CDATA #FIXED 'http://www.tei-c.org/ns/1.0'>

<!ELEMENT ns1:fileDesc (ns1:titleStmt,ns1:publicationStmt,
                        ns1:sourceDesc)>
<!ATTLIST ns1:fileDesc
  xmlns:ns1 CDATA #FIXED 'http://www.tei-c.org/ns/1.0'>

<!ELEMENT ns1:encodingDesc (ns1:p)>
<!ATTLIST ns1:encodingDesc
  xmlns:ns1 CDATA #FIXED 'http://www.tei-c.org/ns/1.0'>

<!ELEMENT ns1:profileDesc (ns1:correspDesc)>
<!ATTLIST ns1:profileDesc
  xmlns:ns1 CDATA #FIXED 'http://www.tei-c.org/ns/1.0'>

<!ELEMENT ns1:body (ns1:head,ns1:opener,ns1:p+,ns1:closer,
                    ns1:postscript)>
<!ATTLIST ns1:body
  xmlns:ns1 CDATA #FIXED 'http://www.tei-c.org/ns/1.0'>

<!ELEMENT ns1:titleStmt (ns1:title)>
<!ATTLIST ns1:titleStmt
  xmlns:ns1 CDATA #FIXED 'http://www.tei-c.org/ns/1.0'>

<!ELEMENT ns1:publicationStmt (ns1:distributor,ns1:date,
                               ns1:availability)>
<!ATTLIST ns1:publicationStmt
  xmlns:ns1 CDATA #FIXED 'http://www.tei-c.org/ns/1.0'>

<!ELEMENT ns1:sourceDesc (ns1:msDesc)>
<!ATTLIST ns1:sourceDesc
  xmlns:ns1 CDATA #FIXED 'http://www.tei-c.org/ns/1.0'>

<!ELEMENT ns1:correspDesc (ns1:correspAction)+>
<!ATTLIST ns1:correspDesc
  xmlns:ns1 CDATA #FIXED 'http://www.tei-c.org/ns/1.0'>

<!ELEMENT ns1:head (#PCDATA)>
<!ATTLIST ns1:head
  xmlns:ns1 CDATA #FIXED 'http://www.tei-c.org/ns/1.0'>

<!ELEMENT ns1:opener (ns1:dateline,ns1:salute)>
<!ATTLIST ns1:opener
  xmlns:ns1 CDATA #FIXED 'http://www.tei-c.org/ns/1.0'>

<!ELEMENT ns1:closer (ns1:salute,ns1:signed)>
<!ATTLIST ns1:closer
  xmlns:ns1 CDATA #FIXED 'http://www.tei-c.org/ns/1.0'>

<!ELEMENT ns1:postscript (ns1:p)+>
<!ATTLIST ns1:postscript
  xmlns:ns1 CDATA #FIXED 'http://www.tei-c.org/ns/1.0'>

<!ELEMENT ns1:distributor (#PCDATA)>
<!ATTLIST ns1:distributor
  xmlns:ns1 CDATA #FIXED 'http://www.tei-c.org/ns/1.0'>

<!ELEMENT ns1:availability (ns1:licence)>
<!ATTLIST ns1:availability
  xmlns:ns1 CDATA #FIXED 'http://www.tei-c.org/ns/1.0'>

<!ELEMENT ns1:msDesc (ns1:msIdentifier)>
<!ATTLIST ns1:msDesc
  xmlns:ns1 CDATA #FIXED 'http://www.tei-c.org/ns/1.0'>

<!ELEMENT ns1:correspAction (ns1:persName,ns1:placeName,ns1:date?)>
<!ATTLIST ns1:correspAction
  xmlns:ns1 CDATA #FIXED 'http://www.tei-c.org/ns/1.0'
  type NMTOKEN #REQUIRED>

<!ELEMENT ns1:dateline (#PCDATA|ns1:placeName)*>
<!ATTLIST ns1:dateline
  xmlns:ns1 CDATA #FIXED 'http://www.tei-c.org/ns/1.0'>

<!ELEMENT ns1:signed (#PCDATA)>
<!ATTLIST ns1:signed
  xmlns:ns1 CDATA #FIXED 'http://www.tei-c.org/ns/1.0'>

<!ELEMENT ns1:licence (#PCDATA|ns1:ref)*>
<!ATTLIST ns1:licence
  xmlns:ns1 CDATA #FIXED 'http://www.tei-c.org/ns/1.0'>

<!ELEMENT ns1:msIdentifier (ns1:settlement,ns1:institution,ns1:idno)>
<!ATTLIST ns1:msIdentifier
  xmlns:ns1 CDATA #FIXED 'http://www.tei-c.org/ns/1.0'>

<!ELEMENT ns1:ref (#PCDATA)>
<!ATTLIST ns1:ref
  xmlns:ns1 CDATA #FIXED 'http://www.tei-c.org/ns/1.0'
  target CDATA #REQUIRED
  type NMTOKEN #REQUIRED>

<!ELEMENT ns1:settlement (#PCDATA)>
<!ATTLIST ns1:settlement
  xmlns:ns1 CDATA #FIXED 'http://www.tei-c.org/ns/1.0'>

<!ELEMENT ns1:institution (#PCDATA)>
<!ATTLIST ns1:institution
  xmlns:ns1 CDATA #FIXED 'http://www.tei-c.org/ns/1.0'>

<!ELEMENT ns1:idno (#PCDATA)>
<!ATTLIST ns1:idno
  xmlns:ns1 CDATA #FIXED 'http://www.tei-c.org/ns/1.0'>

<!ELEMENT ns1:title (#PCDATA)>
<!ATTLIST ns1:title
  xmlns:ns1 CDATA #FIXED 'http://www.tei-c.org/ns/1.0'>

<!ELEMENT ns1:date (#PCDATA)>
<!ATTLIST ns1:date
  xmlns:ns1 CDATA #FIXED 'http://www.tei-c.org/ns/1.0'
  when NMTOKEN #IMPLIED>

<!ELEMENT ns1:p (#PCDATA|ns1:date|ns1:persName|ns1:title|ns1:orgName)*>
<!ATTLIST ns1:p
  xmlns:ns1 CDATA #FIXED 'http://www.tei-c.org/ns/1.0'>

<!ELEMENT ns1:orgName (#PCDATA)>
<!ATTLIST ns1:orgName
  xmlns:ns1 CDATA #FIXED 'http://www.tei-c.org/ns/1.0'
  ref CDATA #REQUIRED>

<!ELEMENT ns1:persName (#PCDATA)>
<!ATTLIST ns1:persName
  xmlns:ns1 CDATA #FIXED 'http://www.tei-c.org/ns/1.0'>

<!ELEMENT ns1:placeName (#PCDATA)>
<!ATTLIST ns1:placeName
  xmlns:ns1 CDATA #FIXED 'http://www.tei-c.org/ns/1.0'>

<!ELEMENT ns1:salute (#PCDATA)>
<!ATTLIST ns1:salute
  xmlns:ns1 CDATA #FIXED 'http://www.tei-c.org/ns/1.0'>
