<?xml version="1.0" encoding="UTF-8"?>
<?xml-model href="http://www.tei-c.org/release/xml/tei/custom/schema/relaxng/tei_all.rng" type="application/xml" schematypens="http://relaxng.org/ns/structure/1.0"?>
<?xml-model href="http://www.tei-c.org/release/xml/tei/custom/schema/relaxng/tei_all.rng" type="application/schematypens="http://purl.oclc.org/dsdl/schematron"?>
<!DOCTYPE TEI SYSTEM "EncodedLetters.dtd">
<TEI xmlns="http://www.tei-c.org/ns/1.0">
    <teiHeader>
        <fileDesc>
            <titleStmt>
                <title>Lettre de Théophile Dufour à Arthur Giry concernant la constitution du Manuel
                    de Diplomatique (1894)</title>
            </titleStmt>
            <publicationStmt>
                <distributor>Sarah Ambec</distributor>
                <date>Octobre 2024</date>
                <availability>
                    <licence>This file is available under a Creative Commons Attribution 4.0
                        licence: <ref type="url"
                            target="https://creativecommons.org/licenses/by/4.0/deed.en"
                            >https://creativecommons.org/licenses/by/4.0/deed.en</ref>. </licence>
                </availability>
            </publicationStmt>
            <sourceDesc>
                <msDesc>
                    <msIdentifier>
                        <settlement>Paris</settlement>
                        <institution>Archives Nationales</institution>
                        <idno>93AJ/264</idno>
                    </msIdentifier>
                </msDesc>
            </sourceDesc>
        </fileDesc>

        <encodingDesc>
            <p>This transcription was created by <persName>Sarah Ambec</persName> in
                    <date>2019</date> for her master’s thesis, a biography of <persName>Arthur
                    Giry</persName>, written at <orgName ref="https://www.sorbonne-universite.fr/"
                    >Sorbonne University</orgName>, Paris. The letters have now been encoded in XML
                in <date>2024</date> as part of a digital humanities project at <orgName
                    ref="https://www.chartes.psl.eu/">École nationale des chartes -
                PSL</orgName>.</p>
        </encodingDesc>

        <profileDesc>
            <correspDesc>
                <correspAction type="sent">
                    <persName>Théophile Dufour</persName>
                    <placeName>Genève</placeName>
                    <date when="1890-11-14"/>
                </correspAction>
                <correspAction type="received">
                    <persName>Arthur Giry</persName>
                    <placeName>Paris</placeName>
                </correspAction>
            </correspDesc>
        </profileDesc>

    </teiHeader>



    <text>
        <body>
            <head> Papier à lettre de la Bibliothèque publique de Genève </head>
            <opener>
                <dateline><placeName>Genève</placeName>, le 14 novembre 1890</dateline>
                <salute>Mon cher confrère et ami,</salute>
            </opener>

            <p>Veuillez m’excuser de n’avoir pas encore répondu à votre demande. Pendant les trois
                semaines qui viennent de s’écouler, le peu de loisir que me laisse la Bibliothèque a
                été absorbé par des Comités électoraux qui tenaient séance tous les jours. Aussi
                ai-je maintenant une série de lettres en retard.</p>

            <p>Mon exemplaire personnel de l’<title>Indicateur d’histoire</title> nuse étant encore
                bâclé, je vous envoie la partie du n°3 de 1886 où se trouve le petit article de
                Monseigneur Brandstetter que vous désirez. Vous verrez, dès les premiers mots, qu’il
                se réfère à un mémoire plus étendu publié par lui dans le tome 25 du
                    <title>Geschiches feund</title>, qui est l’organe de la vocicore d’honneur des
                cieux cantons de Lucernes Uni, Schuzz, Vutenvalden et ZplaceNameug. Ce mémoire, qui
                date de 1870 et qui comprend 41 pages est intitulé <title>Kurze Anleitung zum
                    Vebensehzen der Dahen, mit besonderer Rücksicht auf schweizeriche
                    Urkunden</title>. Si vous ne trouvez pas à Paris la collection du
                    <title>Geichichtefeund</title>, je suis prêt à vous envoyer ce tome 25 en
                communication.</p>

            <p>En ce qui concerne l’ancien diocèse de Genève, et plus tard la République de Genève,
                la question des styles est des plus simples : jusqu’en 1306, style pascal; - de 1306
                à 1575, style natal. Voir <title>Régeste genevois</title>, n°1565 (l’ouvrage se
                trouve à la Bibliothèque de l’Ecole des Chartes). En 1701, introduction du
                calendrier grégorien : Voir [...] de la Société de l’histoire de Genève, t.XXII,
                p.348-357 (même observation).</p>

            <p>Pour les autres cantons, je ne suis pas en mesure de vous donner des renseignements
                aussi certains. Mais, si vous le désirez, il me sera très facile d’écrire à ce sujet
                à quelques amis de Zurich, Berne, Bâle, Fribourg et Lausanne. Je crois que, de cette
                façon, vous auriez du nouveau et du solide, tandis que les Manuels ne font guère,
                d’habitude, que se copier les uns les autres. Usez librement de moi, je serai très
                heureux d’être toujours à votre disposition.</p>

            <closer>
                <salute>Veuillez me rappeler au souvenir de Madame Giry et me croire, je vous prie,
                    votre bien dévoué.</salute>
                <signed>Th Dufour</signed>
            </closer>

            <postscript>
                <p>L’an dernier, je suis allé trois fois à Paris, sans avoir pu, malheureusement,
                    aller vous faire une visite. Il est vrai que, la seconde fois, je demeurais à la
                    campagne, près de Meudon, que la troisième, j’ai pris l’influenza et que la
                    première a été absorbée par l’Exposition et par le mariage d’un de mes parents.
                    Cette année, je me suis reposé! Ce long voyage que j’ai fait si souvent,
                    commence à me fatiguer beaucoup.</p>
                <p>Prière de ne pas égarer les quelques pages de l’<title>Augriger</title> que je
                    vous envoie. C’est une collection très difficile à compléter en cas de perte
                    d’un numéro.</p>
            </postscript>
        </body>
    </text>
</TEI>
